nombreAgrupacionPolitica,codigoAgrupacionPolitica,nombreCandidato,dniCandidato,votos_proyectados,porcentaje_proyectado,diferencia_votos,diferencia_porcentaje
FUERZA POPULAR,8,KEIKO SOFIA FUJIMORI HIGUCHI,10001088,2882397,17.1802,866353,5.1638
JUNTOS POR EL PERÚ,10,ROBERTO HELBERT SANCHEZ PALOMINO,16002918,2016044,12.0164,16351,0.0975
RENOVACIÓN POPULAR,35,RAFAEL BERNARDO LÓPEZ ALIAGA CAZORLA,07845838,1999693,11.9189,156405,0.9322
PARTIDO DEL BUEN GOBIERNO,16,JORGE NIETO MONTESINOS,06506278,1843288,10.9867,143329,0.8543
PARTIDO CÍVICO OBRAS,14,RICARDO PABLO BELMONT CASSINELLI,09177250,1699959,10.1324,369039,2.1996
PARTIDO PAÍS PARA TODOS,23,CARLOS GONSALO ALVAREZ LOAYZA,06002034,1330920,7.9328,107894,0.6431
AHORA NACIÓN - AN,2,PABLO ALFONSO LOPEZ CHAU NAVA,25331980,1223026,7.2897,649855,3.8734
"PRIMERO LA GENTE – COMUNIDAD, ECOLOGÍA, LIBERTAD Y PROGRESO",33,MARIA SOLEDAD PEREZ TELLO,07867789,573171,3.4163,10958,0.0653
PARTIDO SICREO,31,ALFONSO CARLOS ESPA Y GARCES-ALVEAR,10266270,562213,3.351,254455,1.5166
PARTIDO FRENTE DE LA ESPERANZA 2021,21,LUIS FERNANDO OLIVERA VEGA,06280714,307758,1.8344,40978,0.2443
PODEMOS PERÚ,32,JOSE LEON LUNA GALVEZ,07246887,266780,1.5901,52297,0.3117
PARTIDO POLÍTICO COOPERACIÓN POPULAR,25,YONHY LESCANO ANCIETA,01211014,214483,1.2784,21898,0.1305
ALIANZA PARA EL PROGRESO,1,CESAR ACUÑA PERALTA,17903382,192585,1.1479,31164,0.1858
PARTIDO APRISTA PERUANO,12,PITTER ENRIQUE VALDERRAMA PEÑA,43632186,161421,0.9621,8032,0.0478
PARTIDO DEMOCRÁTICO SOMOS PERÚ,20,GEORGE PATRICK FORSYTH SOMMER,41265978,153389,0.9143,9020,0.0538
PARTIDO POLÍTICO PERÚ PRIMERO,29,MARIO ENRIQUE VIZCARRA CORNEJO,04411300,144369,0.8605,110,0.0007
PARTIDO PATRIÓTICO DEL PERÚ,24,HERBERT CALLER GUTIERREZ,43409673,144259,0.8598,4060,0.0242
ALIANZA ELECTORAL VENCEREMOS,3,RONALD DARWIN ATENCIO SOTOMAYOR,41373494,140199,0.8356,11942,0.0711
UN CAMINO DIFERENTE,37,ROSARIO DEL PILAR FERNANDEZ BAZAN,18141156,128257,0.7645,9206,0.0549
PARTIDO DEMÓCRATA UNIDO PERÚ,17,CHARLIE CARRASCO SALAZAR,40799023,119051,0.7096,18818,0.1122
PARTIDO POLÍTICO NACIONAL PERÚ LIBRE,27,VLADIMIR ROY CERRON ROJAS,06466585,100233,0.5974,18271,0.1089
PARTIDO MORADO,22,MESIAS ANTONIO GUEVARA AMASIFUEN,09871134,81962,0.4885,14141,0.0843
UNIDAD NACIONAL,38,ROBERTO ENRIQUE CHIABRA LEON,40728264,67821,0.4042,1944,0.0115
PROGRESEMOS,34,PAUL DAVIS JAIMES BLANCO,40139245,65877,0.3927,1759,0.0105
PARTIDO DEMÓCRATA VERDE,18,ALEX GONZALES CASTILLO,09307547,64118,0.3822,326,0.002
PARTIDO POLÍTICO INTEGRIDAD DEMOCRÁTICA,26,WOLFGANG MARIO GROZO COSTA,07260881,63792,0.3802,22903,0.1365
LIBERTAD POPULAR,11,RAFAEL JORGE BELAUNDE LLOSA,10219647,40889,0.2437,8213,0.0489
AVANZA PAÍS - PARTIDO DE INTEGRACIÓN SOCIAL,7,JOSE DANIEL WILLIAMS ZAPATA,43287528,32676,0.1948,1248,0.0075
PARTIDO POLÍTICO PERÚ ACCIÓN,28,FRANCISCO ERNESTO DIEZ-CANSECO TÁVARA,08263758,31428,0.1873,4237,0.0252
FUERZA Y LIBERTAD,9,FIORELLA GIANNINA MOLINELLI ARISTONDO,25681995,27191,0.1621,3852,0.023
FE EN EL PERÚ,5,ALVARO GONZALO PAZ DE LA BARRA FREIGEIRO,41904418,23339,0.1391,1721,0.0103
PARTIDO DEMOCRATICO FEDERAL,19,ARMANDO JOAQUIN MASSE FERNANDEZ,08255194,21618,0.1288,4038,0.024
SALVEMOS AL PERÚ,36,ANTONIO ORTIZ VILLANO,08587486,17580,0.1048,3113,0.0186
PARTIDO POLÍTICO PRIN,30,WALTER GILMER CHIRINOS PURIZAGA,18870364,14467,0.0862,3058,0.0182
PARTIDO DE LOS TRABAJADORES Y EMPRENDEDORES PTE - PERÚ,15,NAPOLEON BECERRA GARCIA,08058852,11409,0.068,1599,0.0095
PERÚ MODERNO,4,CARLOS ERNESTO JAICO CARRANZA,06529088,9810,0.0585,,
